{
  "schema_version": "1.0.0",
  "robot_model": "g1_29dof",
  "units": {
    "angle": "degrees",
    "time": "seconds"
  },
  "keyframes": [
    {
      "timestamp_s": 0.0,
      "joints_deg": {
        "0": -0.17,
        "1": -0.0,
        "2": -0.02,
        "3": 0.28,
        "4": -0.22,
        "5": 0.0,
        "6": -0.17,
        "7": 0.0,
        "8": 0.02,
        "9": 0.28,
        "10": -0.22,
        "11": -0.0,
        "12": 0.0,
        "13": 0.0,
        "14": 0.0,
        "15": 0.0,
        "16": 11.46,
        "17": 0.0,
        "18": 17.19,
        "19": 0.0,
        "20": 0.0,
        "21": 0.0,
        "22": 0.0,
        "23": -11.46,
        "24": 0.0,
        "25": 17.19,
        "26": 0.0,
        "27": 0.0,
        "28": 0.0
      }
    },
    {
      "timestamp_s": 0.56,
      "joints_deg": {
        "0": -17.94,
        "1": -8.86,
        "2": 4.33,
        "3": 39.82,
        "4": -30.47,
        "5": 0.39,
        "6": -19.12,
        "7": -1.85,
        "8": 9.22,
        "9": 29.86,
        "10": -12.92,
        "11": -1.97,
        "12": 0.0,
        "13": 0.0,
        "14": 0.0,
        "15": 0.0,
        "16": 11.46,
        "17": 0.0,
        "18": 17.19,
        "19": 0.0,
        "20": 0.0,
        "21": 0.0,
        "22": 0.0,
        "23": -11.46,
        "24": 0.0,
        "25": 17.19,
        "26": 0.0,
        "27": 0.0,
        "28": 0.0
      }
    },
    {
      "timestamp_s": 1.1,
      "joints_deg": {
        "0": -20.87,
        "1": -6.6,
        "2": -3.25,
        "3": 51.33,
        "4": -24.69,
        "5": 1.7,
        "6": -35.16,
        "7": -3.41,
        "8": 2.07,
        "9": 54.89,
        "10": -29.52,
        "11": -0.17,
        "12": 0.0,
        "13": 0.0,
        "14": 0.0,
        "15": 0.0,
        "16": 11.46,
        "17": 0.0,
        "18": 17.19,
        "19": 0.0,
        "20": 0.0,
        "21": 0.0,
        "22": 0.0,
        "23": -11.46,
        "24": 0.0,
        "25": 17.19,
        "26": 0.0,
        "27": 0.0,
        "28": 0.0
      }
    },
    {
      "timestamp_s": 1.66,
      "joints_deg": {
        "0": -24.07,
        "1": -7.01,
        "2": 15.01,
        "3": 32.78,
        "4": -16.06,
        "5": 10.38,
        "6": -11.98,
        "7": 14.25,
        "8": 12.95,
        "9": 43.78,
        "10": -3.98,
        "11": -6.25,
        "12": 0.0,
        "13": 0.0,
        "14": 0.0,
        "15": 0.0,
        "16": 11.46,
        "17": 0.0,
        "18": 17.19,
        "19": 0.0,
        "20": 0.0,
        "21": 0.0,
        "22": 0.0,
        "23": -11.46,
        "24": 0.0,
        "25": 17.19,
        "26": 0.0,
        "27": 0.0,
        "28": 0.0
      }
    },
    {
      "timestamp_s": 2.22,
      "joints_deg": {
        "0": -10.92,
        "1": -21.94,
        "2": 6.76,
        "3": 49.03,
        "4": -32.32,
        "5": 1.97,
        "6": 8.9,
        "7": 3.42,
        "8": 21.16,
        "9": 17.67,
        "10": 16.38,
        "11": 17.95,
        "12": 0.0,
        "13": 0.0,
        "14": 0.0,
        "15": 0.0,
        "16": 11.46,
        "17": 0.0,
        "18": 17.19,
        "19": 0.0,
        "20": 0.0,
        "21": 0.0,
        "22": 0.0,
        "23": -11.46,
        "24": 0.0,
        "25": 17.19,
        "26": 0.0,
        "27": 0.0,
        "28": 0.0
      }
    },
    {
      "timestamp_s": 2.76,
      "joints_deg": {
        "0": 1.3,
        "1": 9.66,
        "2": -9.4,
        "3": 36.88,
        "4": 15.53,
        "5": 9.32,
        "6": -56.57,
        "7": -12.59,
        "8": -3.01,
        "9": 111.66,
        "10": -39.41,
        "11": 18.61,
        "12": 0.0,
        "13": 0.0,
        "14": 0.0,
        "15": 0.0,
        "16": 11.46,
        "17": 0.0,
        "18": 17.19,
        "19": 0.0,
        "20": 0.0,
        "21": 0.0,
        "22": 0.0,
        "23": -11.46,
        "24": 0.0,
        "25": 17.19,
        "26": 0.0,
        "27": 0.0,
        "28": 0.0
      }
    },
    {
      "timestamp_s": 3.32,
      "joints_deg": {
        "0": 24.92,
        "1": -7.11,
        "2": 3.38,
        "3": 36.59,
        "4": -16.13,
        "5": 15.81,
        "6": -64.25,
        "7": 27.05,
        "8": -9.13,
        "9": 5.8,
        "10": -11.37,
        "11": 17.35,
        "12": 0.0,
        "13": 0.0,
        "14": 0.0,
        "15": 0.0,
        "16": 11.46,
        "17": 0.0,
        "18": 17.19,
        "19": 0.0,
        "20": 0.0,
        "21": 0.0,
        "22": 0.0,
        "23": -11.46,
        "24": 0.0,
        "25": 17.19,
        "26": 0.0,
        "27": 0.0,
        "28": 0.0
      }
    },
    {
      "timestamp_s": 3.88,
      "joints_deg": {
        "0": -51.37,
        "1": -0.89,
        "2": 10.89,
        "3": 90.97,
        "4": -28.82,
        "5": 2.2,
        "6": -23.53,
        "7": 6.76,
        "8": -6.3,
        "9": 16.77,
        "10": -51.77,
        "11": 15.44,
        "12": 0.0,
        "13": 0.0,
        "14": 0.0,
        "15": 0.0,
        "16": 11.46,
        "17": 0.0,
        "18": 17.19,
        "19": 0.0,
        "20": 0.0,
        "21": 0.0,
        "22": 0.0,
        "23": -11.46,
        "24": 0.0,
        "25": 17.19,
        "26": 0.0,
        "27": 0.0,
        "28": 0.0
      }
    },
    {
      "timestamp_s": 4.42,
      "joints_deg": {
        "0": -67.43,
        "1": -17.86,
        "2": 4.78,
        "3": 88.28,
        "4": -17.93,
        "5": 2.45,
        "6": -21.2,
        "7": 14.6,
        "8": 17.3,
        "9": 36.98,
        "10": -21.69,
        "11": -17.04,
        "12": 0.0,
        "13": 0.0,
        "14": 0.0,
        "15": 0.0,
        "16": 11.46,
        "17": 0.0,
        "18": 17.19,
        "19": 0.0,
        "20": 0.0,
        "21": 0.0,
        "22": 0.0,
        "23": -11.46,
        "24": 0.0,
        "25": 17.19,
        "26": 0.0,
        "27": 0.0,
        "28": 0.0
      }
    },
    {
      "timestamp_s": 4.98,
      "joints_deg": {
        "0": -23.07,
        "1": 9.16,
        "2": 12.59,
        "3": 105.17,
        "4": -38.72,
        "5": 6.99,
        "6": -68.54,
        "7": 3.33,
        "8": -1.58,
        "9": 19.62,
        "10": -44.33,
        "11": 18.32,
        "12": 0.0,
        "13": 0.0,
        "14": 0.0,
        "15": 0.0,
        "16": 11.46,
        "17": 0.0,
        "18": 17.19,
        "19": 0.0,
        "20": 0.0,
        "21": 0.0,
        "22": 0.0,
        "23": -11.46,
        "24": 0.0,
        "25": 17.19,
        "26": 0.0,
        "27": 0.0,
        "28": 0.0
      }
    }
  ]
}